patient.first_name,patient.last_name,patient.age,patient.sex,patient.dob,patient.phone,patient.address.street,patient.address.city,patient.address.state,patient.address.zip,date_of_service.chart_num,date_of_service.date_of_service,provider.name,provider.address.street,provider.address.city,provider.address.state,provider.address.zip,provider.phone,provider.fax,visit_diagnosis.code,visit_diagnosis.description,vital_signs.happiness,vital_signs.anxiety_stress,vital_signs.suicidal_thoughts,vital_signs.depression,vital_signs.energy_level,vital_signs.sleep_quality,vital_signs.impulsivity,vital_signs.mania,vital_signs.psychotic_symptoms,vital_signs.hours_of_sleep,vital_signs.height,vital_signs.weight,vital_signs.bmi,current_medications.Abilify.dose,current_medications.Abilify.frequency,med_management_notes.start_time,med_management_notes.stop_time,med_management_notes.total_time,med_management_notes.visit_type,med_management_notes.supervising_physician,med_management_notes.chief_complaint,med_management_notes.history_of_present_illness,target_symptoms.anxiety,target_symptoms.depression,treatment_plan.health_safety_goals.goal_1,treatment_plan.behavioral_rel_goals.goal_1,treatment_plan.emotional_goals.goal_1,treatment_plan.int_mental_goals.goal_1,treatment_plan.personal_goals.goal_1,current_allergies.status,risk_assessment.issues,lab_monitoring.tests,follow_up.treatment_plan,follow_up.next_appointment,follow_up.prescribed_treatment,signature_info.signed_by,signature_info.title,signature_info.date_time,signature_info.license,side_effects_concerns,patient.DOB,visit_diagnosis.diagnosis,current_meds.Seroquel.dosage,current_meds.Seroquel.frequency,psych_med_history.history,psych_med_history.hist_drug_use,psych_med_history.curr_drug_use,new_med_rec.recommendations,current_allergies.allergies,med_management_notes.history_present_illness,exam.mental_status_exam.suicidal_ideation,exam.mental_status_exam.homicidal_ideation,exam.mental_status_exam.hallucination,exam.mental_status_exam.illusion_misperception,exam.mental_status_exam.delusion,exam.mental_status_exam.ideas_of_reference,exam.mental_status_exam.thought_process,exam.mental_status_exam.sensorium,exam.mental_status_exam.executive_functioning,exam.mental_status_exam.abstract_thinking,exam.mental_status_exam.insight_into_illness,exam.mental_status_exam.judgement,exam.mental_status_exam.reliability,exam.mental_status_exam.cognition,treatment_plan.health_safety_goals,treatment_plan.behavioral_rel_goals,treatment_plan.emotional_goals,treatment_plan.int_mental_goals,treatment_plan.personal_goals,treatment_plan.completed_goals,risk_assessment.risk_issues,lab_monitoring.monitoring,referrals.referrals,therapy.therapy,solace_vital_signs.happiness,solace_vital_signs.anxiety_stress,solace_vital_signs.suicidal_thoughts,solace_vital_signs.depression,solace_vital_signs.energy_level,solace_vital_signs.sleep_quality,solace_vital_signs.impulsivity,solace_vital_signs.mania,solace_vital_signs.psychotic_symptoms,solace_vital_signs.hours_of_sleep,solace_vital_signs.measurements.height,solace_vital_signs.measurements.weight,solace_vital_signs.measurements.bmi,important_reactions.Zyprexa,important_reactions.Seroquel,reported_side_effects.Latuda,psychiatric_medication_history.historical_drug_use,psychiatric_medication_history.current_drug_use,new_medication_recommendations.Lamictal.start,target_symptoms.mood_related_psychotic_symptoms,exam.mental_status_exam.general_appearance,exam.mental_status_exam.hygiene,exam.mental_status_exam.motor_exam,current_allergies.NKDA,treatment_plan.health_safety_goals.goal_1.description,treatment_plan.health_safety_goals.goal_1.date_created,treatment_plan.health_safety_goals.goal_1.severity,treatment_plan.health_safety_goals.goal_1.improvement_target,treatment_plan.health_safety_goals.goal_1.time_to_resolution,treatment_plan.health_safety_goals.goal_1.objective,treatment_plan.emotional_goals.goal_1.description,treatment_plan.emotional_goals.goal_1.date_created,treatment_plan.emotional_goals.goal_1.severity,treatment_plan.emotional_goals.goal_1.improvement_target,treatment_plan.emotional_goals.goal_1.time_to_resolution,treatment_plan.emotional_goals.goal_1.objective,treatment_plan.intellectual_mental_goals.goal_1,risk_assessment.description,referrals.description,therapy.description,follow_up.description,vital_signs.measurements.height,vital_signs.measurements.weight,vital_signs.measurements.bmi,current_meds.medications,current_meds.side_effects,exam.mental_status_exam.attitude_behavior,exam.mental_status_exam.mood,exam.mental_status_exam.affect,referrals.to,visit_diagnosis.diagnoses,current_medications.Seroquel,current_medications.Paxil,current_medications.Wellbutrin XL,current_medications.trazodone,current_medications.sertraline,current_medications.Xanax,current_medications.Zoloft,current_medications.Klonopin,target_symptoms.maintenance,treatment_plan.emotional_goals.goal_1.name,treatment_plan.emotional_goals.goal_1.interventions,treatment_plan.emotional_goals.goal_1.comments,treatment_plan.risk_assessment.assessment,treatment_plan.lab_monitoring.monitoring,treatment_plan.referrals.referral_1,treatment_plan.follow_up.plan,treatment_plan.follow_up.next_appointment,treatment_plan.follow_up.treatment
Caylee,Test,25,Female,1998-07-30,727-255-9083,1234 TEST ROAD,LAND O LAKES,FL,34638,123456,2023-05-10,"Tanveer Chaudhry, MD",17222 HOSPITAL BLVD STE 120,BROOKSVILLE,FL,34601-8925,352-678-5550,352-678-5551,F33.0,Major Depressive Disorder Recurrent: Mild,6/10,1/10,5/10,5/10,5/10,5/10,5/10,5/10,5/10,5.0,60.0,230.0,44.9,10 mg,QAM,11:22 AM,11:22 AM,3 minutes,Medication check and follow-up,Dr. Chaudhry,Pt reports doing fine. No new complaints being reported at this time. No problem reported.,xx,"Generalized anxiety, ongoing worry and insomnia.","Depressed mood, periods of sadness and lack of ability to feel joy.","Client will reduce overall frequency, intensity, and duration of reported symptoms related to physical trauma.",N/A: Domain not applicable at this time. Provider to reevaluate next session.,"FEAR/ANXIETY: Client will reduce overall frequency, intensity, and duration of anxiety symptoms to improve daily functioning.",N/A: Domain not applicable at this time. Provider to reevaluate next session.,N/A: Domain not applicable at this time. Provider to reevaluate next session.,NKDA,Prior history of suicide attempts.,"['CMP', 'CBC with Diff.', 'HgbA1c', 'Lipid Panel']",Continue current treatment plan.,3 month(s),Continue current prescribed therapy.,"Tanveer Chaudhry, MD",MD,2023-05-10 11:24 AM,ME85148,,,,,,,,,,,,,,,,,,,,,,,,,,,,,,,,,,,,,,,,,,,,,,,,,,,,,,,,,,,,,,,,,,,,,,,,,,,,,,,,,,,,,,,,,,,,,,,,,,,,,,,,
Angelika,Test,10 months,Female,,,4800 ROWAN ROAD,NEW PORT RICHEY,FL,34653-4046,TEST,2023-03-31,"Shodhan Patel, MD",4800 ROWAN ROAD,NEW PORT RICHEY,FL,34653-5609,352-678-5550,352-678-5551,,,,,,,,,,,,,,,,,,10:06 AM,,,The purpose of this visit was a medication check and follow-up.,,,,,,,,,,,,,,Continue current treatment plan.,3 month(s),Continue current prescribed treatment with current NP. Medication management and psychotherapeutic interventions as needed (PRN). Prescribed Treatment: Continue current prescribed therapy.,,,,,None at this time.,2022-07-15,,100 mg,HS,,N/A,N/A,Continue current medications without any change.,No allergies on file,,None reported at this time,None reported at this time,None reported at this time,None reported at this time,None reported at this time,None reported at this time,"Linear, logical and goal oriented",Clear,Intact,Suboptimal,Some denial,Mildly impaired,Questionable,No gross deficits observed,[],[],[],[],[],[],Continues to have risks inherent to disease state.,None at this time.,None at this time.,No therapy,,,,,,,,,,,,,,,,,,,,,,,,,,,,,,,,,,,,,,,,,,,,,,,,,,,,,,,,,,,,,,,,,,,,,
Caylee,Test,25,Female,1998-07-30,727-255-9083,1234 TEST ROAD,LAND O LAKES,FL,34638,123456,2023-06-22,"Shodhan Patel, MD",4800 ROWAN ROAD,NEW PORT RICHEY,FL,34653-5609,352-678-5550,352-678-5551,F33.0,Major Depressive Disorder Recurrent: Mild,,,,,,,,,,,,,,10 mg,QAM,10:42 AM,,,Medication check and follow-up. Video visit at patient's home,Self,Pt reports doing fine. No new complaints.,Interval sentinel events: Suicide Attempt(s): x3 more than 5 years ago,,,,N/A,,,N/A,,,"['CMP', 'CBC with Diff.', 'HgbA1c', 'Lipid Panel']",,,,,,,,,,,,,,,,,,,Endorsed with no intent or plans,"With intent, no plans reported",None reported,None reported,None reported,None reported,"Linear, logical, goal oriented",Clear,Intact,Suboptimal,Some denial,Mildly impaired,Questionable,No gross deficits observed,,,,,,,,,,,6/10,1/10,5/10,5/10,5/10,5/10,5/10,5/10,5/10,5.0,60.0,230.0,44.9,Weight gain,Weight gain,Grinding teeth,N/A,N/A,"25mg x 2 weeks, then 50 mg x 2 weeks",Present,Neatly dressed,Adequate,Limited due to tele-health,No known drug allergies,"Client will reduce overall frequency, intensity, and duration of reported symptoms related to physical trauma",2022-08-13,Moderate,25%,6 months,Learn/demonstrate understanding of Fight/Flight/Freeze distress,"FEAR/ANXIETY: Client will reduce overall frequency, intensity, and duration of anxiety symptoms to improve daily functioning",2022-08-13,Moderate,50%,6 months,Learn/demonstrate understanding of Fight/Flight/Freeze distress,N/A,Prior history of suicide attempts,None at this time,No therapy,Continue current treatment plan. Continue current prescribed treatment with current NP. Medication management and psychotherapeutic interventions as needed (PRN). Prescribed Treatment: Continue current prescribed therapy.,,,,,,,,,,,,,,,,,,,,,,,,,,,,
Bkv,Test,54,Male,1967-12-31,352-678-5550,226 17222 HOSPITAL BLVD,BROOKSVILLE,FL,34601,1,2022-12-27,"Tanveer Chaudhry, MD",17222 HOSPITAL BLVD STE 226,BROOKSVILLE,FL,34601-8925,352-678-5550,352-678-5551,F43.12,Post-traumatic Stress Disorder Chronic,9/10,2/10,0/10,1/10,3/10,6/10,2/10,0/10,0/10,7.0,,,,,,07:14 PM,07:16 PM,1 minute,Medication check and follow-up via video conferencing,Self,Lack of energy and desire to sit,Recent change in status from worker to injured non-worker,,Get into counseling to find purpose in life,Minimize negative mental health symptoms related to chronic physical health issues,N/A,N/A,N/A,Identify resources for obtaining new employment,,,,Continue current treatment plan,3 months,Continue current prescribed therapy,"Tanveer Chaudhry, MD",MD,2022-12-27 07:16 PM,ME85148,,,,,,['Abilify'],N/A,N/A,Continue current medications without any change,,,None,None,None,None,None,None,"Linear, logical, goal-oriented",Clear,Intact,Suboptimal,Some denial,Mildly impaired,Questionable,No gross deficits observed,,,,,,N/A,Continues to have risks inherent to disease state,None at this time,,,,,,,,,,,,,,,,,,,,,,,1,1,1,,,,,,,,,,,,,,,,,,,77.0,236.0,28.0,"[{'name': 'lithium carbonate', 'dose': '300 mg', 'frequency': 'TID'}, {'name': 'sertraline', 'dose': '100 mg', 'frequency': 'QD'}, {'name': 'Lexapro', 'dose': '10 mg', 'frequency': 'QAM'}]",None at this time,1,1,1,counseling,,,,,,,,,,,,,,,,,,,
Amorette,Test,27,Female,1996-12-26,352-678-8460,4800 Rowan Rd,New Port Richey,FL,34653,09876,2023-10-19,"Lisa Wolf, APRN",17222 HOSPITAL BLVD STE 120,BROOKSVILLE,FL,34601-8925,352-678-5550,352-678-5551,99214,Established Patient Office Visit - 30-39 minutes,,,,,,,,,,,,,,,,10:17 AM,10:23 AM,5 minutes,Medication check and follow-up,Dr. Chaudhry,Refills. 'Doing much better.',States he had clots removed and vein is cleared out. 'My heart doctor is really happy. I have no clots.' States anxiety is 'down for me. It's down a lot.' States he and his service dog are happy again. Client started painting again. 'Things are going good.',,,N/A: Domain not applicable at this time. Provider to reevaluate next session.,N/A: Domain not applicable at this time. Provider to reevaluate next session.,,N/A: Domain not applicable at this time. Provider to reevaluate next session.,N/A: Domain not applicable at this time. Provider to reevaluate next session.,,,,,,,Lisa Wolf,APRN,2023-10-19 10:25 AM,APRN11011057,,,,,,,,,,,,None reported,None reported,None reported,None reported,None reported,,"Linear, logical and goal oriented",Clear,Intact,Suboptimal,Limited,Mildly impaired,Questionable,No gross deficits observed,,,,,,,,,,,8/10,5/10,0/10,4/10,7/10,10/10,1/10,0/10,0/10,8.0,70.0,269.0,38.6,,,,,,,,Casually dressed,"Clean, well kept",Limited exam due to tele-health but grossly intact. BUE tremors,,,,,,,,"Client will reduce overall frequency, intensity, and duration of anxiety symptoms to improve daily functioning.",2022-11-02,Moderate,50%,6 months,"['Learn/demonstrate understanding of Fight/Flight/Freeze distress', 'Learn/demonstrate 2-3 mindfulness techniques to manage symptoms']",,,,,,,,,,,Calm and cooperative; pleasant,Happy,Bright. Mood Congruent,,"['F40.01 AGORAPHOBIA WITH PANIC DISORDER', 'F33.1 MAJOR DEPRESSIVE DISORDER, RECURRENT, MODERATE']","100 mg, HS","10 mg, QD","300 mg, QAM","50 mg, BID","100 mg, QD","1 mg, TID","100 mg, QAM","0.5 mg, QD",Focus on maintaining stability with medication compliance and monitoring for signs and symptoms of mental illness during medication management follow-up appointments.,FEAR/ANXIETY,['Client to attend regular medication management appointments and take prescriptions as prescribed'],States anxiety is down a lot.,No safety issues determined at this time. Continues to have risks inherent to disease state.,PCP monitors and client will notify Solace of any abnormal results.,Psychotherapy,Continue current treatment plan,3 month(s),Continue current prescribed treatment with current NP. Medication management and psychotherapeutic interventions as needed (PRN). Prescribed Treatment: Continue current prescribed therapy.
